{
  "schema_identity": "infinium.repository.m1-slice6-successor-independent-review/3.0.0",
  "review_id": "infinium.m1-s6.successor-runtime-attempt-review-v3/WP9/attempt-8/4d5a7062-4d4e-4875-861c-a7fa54806da0",
  "review_kind": "runtime-attempt",
  "verdict": "accept",
  "reviewer_id": "/root/successor-design-review",
  "independent": true,
  "provider_effect_used": false,
  "subject": {
    "id": "m1-s6-successor-v6-wp9-runtime-candidate-8/0bc596a0-7ba6-4b3e-847f-49fa3f9f462c",
    "sha256": "f3f7bb451e307841e58e74a933a336bb792734e39a8d3f44a2979e85259c8081"
  },
  "correction": {
    "required": false,
    "defect_id": null,
    "diagnosis_disposition": null,
    "failure_evidence_id": null,
    "failure_evidence_sha256": null,
    "candidate_commit": null
  },
  "findings": [],
  "reviewed_at_utc": "2026-08-21T19:30:22.6486267+00:00"
}
